{
  "$schema": "http://json-schema.org/draft-07/schema#",
  "title": "data/{code}/state.json — 股票可变状态",
  "type": "object",
  "properties": {
    "tags": {
      "type": "object",
      "properties": {
        "overall":   { "type": "string", "enum": ["green", "yellow", "red", "none"] },
        "watchlist": { "type": "boolean" },
        "quality":   { "type": "string", "enum": ["green", "yellow", "red", "none"] },
        "valuation": { "type": "string", "enum": ["green", "yellow", "red", "none"] },
        "timing":    { "type": "string", "enum": ["green", "yellow", "red", "none"] },
        "risk":      { "type": "string", "enum": ["green", "yellow", "red", "none"] },
        "verdict":   { "type": "string", "enum": ["green", "yellow", "red", "none"] },
        "unread":    { "type": "boolean" }
      }
    },
    "status": { "type": "string" },
    "price_marks": {
      "type": "array",
      "items": {
        "type": "object",
        "required": ["label", "price"],
        "properties": {
          "id":    { "type": "string", "description": "缺失时后端按内容哈希自动生成" },
          "label": { "type": "string" },
          "price": { "type": "number" },
          "type":  { "type": "string", "pattern": "^[a-z0-9_]{1,32}$" },
          "created_at": { "type": "string" },
          "updated_at": { "type": "string" },
          "source": { "type": "string", "enum": ["manual", "agent"], "description": "manual=用户手工，agent=AI 技术面标记；缺失视为 manual" },
          "state": { "type": "string", "enum": ["proposed", "active", "retired", "invalidated", "expired"] },
          "valid_from": { "type": ["string", "null"] },
          "valid_until": { "type": ["string", "null"] },
          "note":   { "type": "string" }
        }
      }
    },
    "notes": { "type": "array" },
    "record_prices": {
      "type": "object",
      "properties": {
        "notes":   { "type": "object", "additionalProperties": { "type": ["number", "null"] } },
        "reports": { "type": "object", "additionalProperties": { "type": ["number", "null"] } }
      }
    },
    "holdings": { "type": ["object", "null"] }
  }
}
