{
  "tags": {
    "overall": "yellow",
    "watchlist": true,
    "quality": "yellow",
    "valuation": "yellow",
    "timing": "red",
    "risk": "red",
    "verdict": "none",
    "unread": true
  },
  "notes": [
    {
      "time": "2026-09-15 08:53",
      "content": "2026-09-15：POF热收缩膜国内第一全球第二，常德国资入主后治理改善+业绩修复（H1扣非+66%、现金流+214%），SEPS量产、光纤油膏SEP供长飞订单+20-30%。今日放量涨停（3.6倍量）站上全部短期均线，但J=91.5/RSI6=85.5严重超买，近一年涨停次日红盘率仅33%。等回踩5.4-5.5缩量企稳，止损5.16。",
      "price": 5.81
    }
  ],
  "holdings": {},
  "price_marks": [],
  "record_prices": {
    "notes": {
      "2026-09-15 08:53": 5.81
    },
    "reports": {}
  },
  "status": "unassessed"
}