{
  "tags": {
    "unread": false,
    "watchlist": false,
    "overall": "yellow",
    "quality": "yellow",
    "valuation": "none",
    "timing": "none",
    "risk": "yellow",
    "verdict": "yellow"
  },
  "status": "avoid",
  "notes": [
    {
      "time": "2026-09-03 05:48",
      "content": "亏损，没什么前途。"
    }
  ],
  "holdings": {},
  "price_marks": []
}