{
  "tags": {
    "watchlist": false
  },
  "notes": [
    {
      "time": "2026-09-09 15:13",
      "content": "航空材料，净利高，当前估值不错。",
      "price": 19.05
    }
  ],
  "holdings": {},
  "price_marks": [],
  "record_prices": {
    "notes": {
      "2026-09-09 15:13": 19.05
    },
    "reports": {}
  },
  "status": "bullish"
}