{
  "tags": {
    "unread": false,
    "watchlist": false,
    "overall": "red",
    "quality": "green",
    "valuation": "red",
    "timing": "red",
    "risk": "red",
    "verdict": "red"
  },
  "status": "neutral",
  "notes": [
    {
      "time": "2026-09-03 06:46",
      "content": "虽然涨了很多但居然有还不算太贵，不过应该不能持续，看看吧。"
    }
  ],
  "holdings": {},
  "price_marks": []
}