{
  "tags": {
    "overall": "yellow",
    "watchlist": true,
    "quality": "yellow",
    "valuation": "red",
    "timing": "yellow",
    "risk": "red",
    "verdict": "none",
    "unread": false
  },
  "notes": [
    {
      "time": "2026-09-17 11:35",
      "content": "晶振龙头，但这个行业竞争激烈，且高频晶振占比少，净利润低，配不上价格。",
      "price": 36.63
    }
  ],
  "holdings": {},
  "price_marks": [],
  "record_prices": {
    "notes": {
      "2026-09-17 11:35": 36.63
    },
    "reports": {}
  },
  "status": "neutral"
}