{
  "tags": {
    "unread": false,
    "watchlist": false,
    "overall": "yellow",
    "quality": "green",
    "valuation": "yellow",
    "timing": "yellow",
    "risk": "yellow",
    "verdict": "yellow"
  },
  "status": "bullish",
  "notes": [],
  "holdings": {},
  "price_marks": [
    {
      "id": "67924f4b",
      "label": "标记",
      "price": 262.44,
      "type": "mark",
      "created_at": "2026-08-14T03:59:07.728456+00:00"
    }
  ]
}