{
  "tags": {
    "overall": "red",
    "quality": "yellow",
    "valuation": "red",
    "timing": "red",
    "risk": "red",
    "verdict": "red",
    "watchlist": false,
    "unread": false
  },
  "price_marks": [],
  "notes": [
    {
      "time": "2026-10-07 11:37",
      "content": "历史原因看看，不碰。",
      "price": 20.55
    }
  ],
  "holdings": {},
  "record_prices": {
    "notes": {
      "2026-10-07 11:37": 20.55
    },
    "reports": {}
  },
  "status": "avoid"
}