{
  "tags": {
    "overall": "yellow",
    "quality": "yellow",
    "valuation": "green",
    "timing": "yellow",
    "risk": "yellow",
    "verdict": "yellow",
    "watchlist": false,
    "unread": true
  },
  "price_marks": [],
  "notes": [],
  "holdings": {},
  "record_prices": {
    "notes": {},
    "reports": {}
  },
  "status": "unassessed"
}
