{
  "tags": {
    "overall": "green",
    "watchlist": false,
    "quality": "green",
    "valuation": "yellow",
    "timing": "yellow",
    "risk": "yellow"
  },
  "price_marks": [
    {
      "id": "dd539ec8",
      "label": "标记",
      "price": 63.35,
      "type": "mark",
      "created_at": "2026-09-06T07:55:02.930120+00:00"
    }
  ],
  "notes": [
    {
      "time": "2026-09-06 07:52",
      "content": "掩膜，好公司，贵了点，50以下再说。",
      "price": 63.35
    }
  ],
  "status": "tracking",
  "holdings": {},
  "record_prices": {
    "notes": {
      "2026-09-06 07:52": 63.35
    },
    "reports": {}
  }
}