{
  "tags": {
    "watchlist": false
  },
  "notes": [
    {
      "time": "2026-09-09 15:16",
      "content": "ROE下降但依然不低，毛利率高，好公司，当前价格也不高。",
      "price": 24.17
    }
  ],
  "holdings": {},
  "price_marks": [],
  "record_prices": {
    "notes": {
      "2026-09-09 15:16": 24.17
    },
    "reports": {}
  },
  "status": "bullish"
}