{
  "tags": {
    "watchlist": false
  },
  "notes": [
    {
      "time": "2026-09-09 15:07",
      "content": "军工下游，利润薄弱，20以下见。",
      "price": 34.16
    }
  ],
  "holdings": {},
  "price_marks": [],
  "record_prices": {
    "notes": {
      "2026-09-09 15:07": 34.16
    },
    "reports": {}
  },
  "status": "waiting"
}