{
  "tags": {
    "unread": false,
    "watchlist": false,
    "overall": "yellow",
    "quality": "yellow",
    "valuation": "yellow",
    "timing": "none",
    "risk": "yellow",
    "verdict": "yellow"
  },
  "status": "no_interest",
  "notes": [
    {
      "time": "2026-08-14 03:58",
      "content": "国企，但盈利能力不大行。"
    }
  ],
  "holdings": {},
  "price_marks": []
}