{
  "tags": {
    "unread": false,
    "watchlist": false,
    "overall": "yellow",
    "quality": "yellow",
    "valuation": "yellow",
    "timing": "none",
    "risk": "yellow",
    "verdict": "yellow"
  },
  "status": "neutral",
  "notes": [
    {
      "time": "2026-09-03 06:46",
      "content": "毛利率高ROE低，涨太多了先观望。"
    }
  ],
  "holdings": {},
  "price_marks": []
}