{
  "tags": {
    "overall": "red",
    "watchlist": true,
    "quality": "red",
    "valuation": "red",
    "timing": "yellow",
    "risk": "red",
    "verdict": "red"
  },
  "status": "avoid",
  "price_marks": [],
  "notes": [],
  "holdings": {},
  "record_prices": {
    "notes": {},
    "reports": {}
  }
}